_unit_id$,$pair_id$,$relation_gold$,$relation_gold_reason$,$sentence_1$,$sentence_2$,$speaker_1$,$speaker_2$,$topic
0$,$0$,$Support$,$This is a support$,$The greatest, before COVID came in the greatest economy in history, lowest unemployment numbers, everything was good.$,$Everything was going.$,$Donald Trump$,$Donald Trump$,$Why They Should Be Elected
0$,$0$,$Support$,$This is a support$,$[crosstalk 00:01:31].$,$… and then I do want to follow up on the election security.$,$Joe Biden$,$Kristen Welker$,$National Security
0$,$0$,$Support$,$This is a support$,$The answer is, depending on how clear… Vaccines, they say, have a very positive impact and that you’re going to affect positively 85% of the American public.$,$Or there’s others say, “This vaccine is really the key.$,$Joe Biden$,$Joe Biden$,$COVID
0$,$0$,$Support$,$This is a support$,$Making sure that we can do that, we’re going to put 500,000 charging stations in all of the highways that we’re going to be building in the future.$,$We’re going to build a economy that in fact is going to provide for the ability of us to take 4 million buildings and make sure that they in fact are weatherized in a way that in fact will they’ll emit significantly less gas and oil because the heat will not be going out.$,$Joe Biden$,$Joe Biden$,$Climate change
0$,$0$,$Support$,$This is a support$,$And right now, they do the right thing.$,$When they run into a serious problem, they halt the test.$,$Joe Biden$,$Joe Biden$,$COVID
0$,$0$,$Support$,$This is a support$,$When the president seeks a second term, it is generally a referendum on his record but vice president Biden, you’d like to quote one of your dad’s sayings, which is don’t compare me to the almighty, compare me to the alternative.$,$And in this case sir you are the alternative.$,$Chris Wallace$,$Chris Wallace$,$Why They Should Be Elected
0$,$0$,$Support$,$This is a support$,$… in the second quarter.$,$The unemployment rate fell to 8.4% last month.$,$Chris Wallace$,$Chris Wallace$,$Economy
0$,$0$,$Support$,$This is a support$,$I’m talking about when it’s generally available, not-$,$Well, we’re going to deliver it right away.$,$Chris Wallace$,$Donald Trump$,$COVID
0$,$0$,$Attack$,$This is an attack$,$That’s what’s happening and what right now, by the way, Wall Street firms indicated that my plan, my plan will in fact, create 18.6 million jobs, 7 million more than his.$,$This is from Wall Street and I’ll create $1 trillion more in economic growth than his proposal does.$,$Joe Biden$,$Joe Biden$,$Climate change
0$,$0$,$Support$,$This is a support$,$It could also be after that.$,$I’m talking about when it’s generally available, not-$,$Donald Trump$,$Chris Wallace$,$COVID
